{
  "$schema": "../../../ProjectWorld/Data/Schemas/project_world_authored_overlay.schema.json",
  "schema_version": 1,
  "overlay_set_id": "synthetic_mesh_terrain_streaming_v1",
  "world_data_plugin": "ProjectWorldTestData",
  "grid_id": "grid_59f7c349811628ae",
  "resolver_version": 3,
  "provenance": [
    {
      "provenance_id": "synthetic_fixture_survey",
      "horizontal_accuracy_m": 0.05
    }
  ],
  "overlays": [
    {
      "overlay_id": "coordinate_marker",
      "authored_package": "/ProjectWorldTestData/Authored/Fixtures/L_ProjectWorldMarker",
      "anchor": {
        "kind": "coordinate",
        "placement_class": "precision",
        "provenance_ref": "synthetic_fixture_survey",
        "horizontal_tolerance_m": 0.1,
        "canonical_crs": "ALIS:FIXTURE_METRE_V1",
        "easting_m": -500.0,
        "northing_m": 500.0,
        "vertical_mode": "surface_snap",
        "vertical_tolerance_m": 0.1,
        "orientation": {"yaw_degrees": 15.0}
      }
    },
    {
      "overlay_id": "feature_marker",
      "authored_package": "/ProjectWorldTestData/Authored/Fixtures/L_ProjectWorldMarker",
      "anchor": {
        "kind": "feature",
        "feature_id": "alis:synthetic:way:100",
        "expected_feature_class": "road",
        "expected_geometry_type": "LineString",
        "expected_easting_m": 0.0,
        "expected_northing_m": 500.0,
        "placement_class": "precision",
        "provenance_ref": "synthetic_fixture_survey",
        "horizontal_tolerance_m": 0.1,
        "vertical_mode": "surface_snap",
        "vertical_tolerance_m": 0.1
      }
    },
    {
      "overlay_id": "protected_mask",
      "authored_package": "/ProjectWorldTestData/Authored/Fixtures/L_ProjectWorldMarker",
      "anchor": {
        "kind": "mask",
        "canonical_crs": "ALIS:FIXTURE_METRE_V1",
        "bounds_m": [-750.0, 250.0, -250.0, 750.0],
        "excludes": ["vegetation"]
      }
    }
  ]
}
